{
  "event_id": "fixture-001",
  "timestamp": "2026-06-14T15:00:00Z",
  "agent": "qa-tester",
  "activity": "write-tests",
  "ais_step": "Verify",
  "autonomy_level": "L2",
  "outcome": "success",
  "repo": "AIS-Commercial-Business-Unit/AgenticSDLC",
  "evidence": [
    "tests/phase3-schemas.test.js created",
    "tests/phase3-agents.test.js created",
    "tests/adoption.test.js created",
    "tests/metrics.test.js created"
  ],
  "duration_seconds": 120,
  "notes": "Phase 3 QA test suite scaffolded — forward-looking tests ready for AIArchitect schema and script delivery"
}
